{
  "type": "llm_decision",
  "action": "code_generate",
  "task_id": "5",
  "files_created": [
    "server/bo/src/main/java/com/softsquared/template/ecommerce/bo/domains/point/controller/GrantController.java,server/bo/src/main/java/com/softsquared/template/ecommerce/bo/domains/point/GrantService.java,server/bo/src/main/java/com/softsquared/template/ecommerce/bo/domains/point/model/CreateGrantRequest.java,server/bo/src/main/java/com/softsquared/template/ecommerce/bo/domains/point/model/GrantResponse.java"
  ],
  "files_modified": [],
  "timestamp": "2026-03-24T06:35:00Z"
}
